{
  "schema_version": "home-tutor.ocr-session.v1",
  "session_id": "a1000001-0001-4001-8001-000000000001",
  "grade_level": "primary",
  "subject": "math",
  "started_at": "2026-06-22T14:00:00.000Z",
  "ended_at": "2026-06-22T14:59:55.000Z",
  "pages": [
    {
      "page_id": "page_1",
      "index": 1
    },
    {
      "page_id": "page_2",
      "index": 2
    },
    {
      "page_id": "page_3",
      "index": 3
    },
    {
      "page_id": "page_4",
      "index": 4
    }
  ],
  "questions": [
    {
      "question_id": "q01",
      "page_id": "page_1",
      "index_on_page": 1,
      "prompt_text": "新苗幼儿园大班有男孩126人，女孩84人。中班人数是大班人数的6/7。新苗幼儿园中班有　人。",
      "prompt_region_ids": [
        "r_prompt_q01"
      ],
      "answer_region_ids": [
        "r_answer_q01"
      ],
      "question_type": "fill_blank"
    },
    {
      "question_id": "q02",
      "page_id": "page_1",
      "index_on_page": 2,
      "prompt_text": "（　）米的2/5是12米，36kg比（　）kg多1/2。",
      "prompt_region_ids": [
        "r_prompt_q02"
      ],
      "answer_region_ids": [
        "r_answer_q02"
      ],
      "question_type": "fill_blank"
    },
    {
      "question_id": "q03",
      "page_id": "page_1",
      "index_on_page": 3,
      "prompt_text": "淘淘要画一个等腰三角形，顶角和一个底角的度数比是1：2，顶角　°，每个底角　°。",
      "prompt_region_ids": [
        "r_prompt_q03"
      ],
      "answer_region_ids": [
        "r_answer_q03"
      ],
      "question_type": "fill_blank"
    },
    {
      "question_id": "q04",
      "page_id": "page_1",
      "index_on_page": 4,
      "prompt_text": "圆规两脚张开3cm，所画圆的直径　cm，周长　cm，面积　cm²。",
      "prompt_region_ids": [
        "r_prompt_q04"
      ],
      "answer_region_ids": [
        "r_answer_q04"
      ],
      "question_type": "fill_blank"
    },
    {
      "question_id": "q05",
      "page_id": "page_1",
      "index_on_page": 5,
      "prompt_text": "小麦出粉率85%，500千克小麦可磨出　千克面粉，磨340千克面粉需小麦　千克。",
      "prompt_region_ids": [
        "r_prompt_q05"
      ],
      "answer_region_ids": [
        "r_answer_q05"
      ],
      "question_type": "fill_blank"
    },
    {
      "question_id": "q06",
      "page_id": "page_1",
      "index_on_page": 6,
      "prompt_text": "按规律继续画下去，第（6）个图形共有　个。",
      "prompt_region_ids": [
        "r_prompt_q06"
      ],
      "answer_region_ids": [
        "r_answer_q06"
      ],
      "question_type": "fill_blank"
    },
    {
      "question_id": "q07",
      "page_id": "page_1",
      "index_on_page": 7,
      "prompt_text": "16千克铁的1/4和8千克棉花的3/4一样重。（　）",
      "prompt_region_ids": [
        "r_prompt_q07"
      ],
      "answer_region_ids": [
        "r_answer_q07"
      ],
      "question_type": "fill_blank"
    },
    {
      "question_id": "q08",
      "page_id": "page_1",
      "index_on_page": 8,
      "prompt_text": "0和1的倒数都是它本身。（　）",
      "prompt_region_ids": [
        "r_prompt_q08"
      ],
      "answer_region_ids": [
        "r_answer_q08"
      ],
      "question_type": "fill_blank"
    },
    {
      "question_id": "q09",
      "page_id": "page_1",
      "index_on_page": 9,
      "prompt_text": "比的前项乘5，后项除以1/5，比值不变。（　）",
      "prompt_region_ids": [
        "r_prompt_q09"
      ],
      "answer_region_ids": [
        "r_answer_q09"
      ],
      "question_type": "fill_blank"
    },
    {
      "question_id": "q10",
      "page_id": "page_1",
      "index_on_page": 10,
      "prompt_text": "半径是2厘米的圆的面积跟它的周长相等。（　）",
      "prompt_region_ids": [
        "r_prompt_q10"
      ],
      "answer_region_ids": [
        "r_answer_q10"
      ],
      "question_type": "fill_blank"
    },
    {
      "question_id": "q11",
      "page_id": "page_1",
      "index_on_page": 11,
      "prompt_text": "学校种了98棵树苗，全部成活，成活率是98%。（　）",
      "prompt_region_ids": [
        "r_prompt_q11"
      ],
      "answer_region_ids": [
        "r_answer_q11"
      ],
      "question_type": "fill_blank"
    },
    {
      "question_id": "q12",
      "page_id": "page_1",
      "index_on_page": 12,
      "prompt_text": "K5路公交：有1/5的人下车，又上来此时车上人数的1/5，上车与下车人数相比（　）。",
      "prompt_region_ids": [
        "r_prompt_q12"
      ],
      "answer_region_ids": [
        "r_answer_q12"
      ],
      "question_type": "multiple_choice"
    },
    {
      "question_id": "q13",
      "page_id": "page_1",
      "index_on_page": 13,
      "prompt_text": "学校在公园的东偏北40°方向，公园在学校的（　）方向。",
      "prompt_region_ids": [
        "r_prompt_q13"
      ],
      "answer_region_ids": [
        "r_answer_q13"
      ],
      "question_type": "multiple_choice"
    },
    {
      "question_id": "q14",
      "page_id": "page_1",
      "index_on_page": 14,
      "prompt_text": "240米圆形跑道，爸爸4分钟一圈，小东6分钟一圈，同地相背而行，相遇时间算式（　）。",
      "prompt_region_ids": [
        "r_prompt_q14"
      ],
      "answer_region_ids": [
        "r_answer_q14"
      ],
      "question_type": "multiple_choice"
    },
    {
      "question_id": "q15",
      "page_id": "page_1",
      "index_on_page": 15,
      "prompt_text": "比是4：5，前项加12，要使比值不变，后项应（　）。",
      "prompt_region_ids": [
        "r_prompt_q15"
      ],
      "answer_region_ids": [
        "r_answer_q15"
      ],
      "question_type": "multiple_choice"
    },
    {
      "question_id": "q16",
      "page_id": "page_1",
      "index_on_page": 16,
      "prompt_text": "周长31.4cm的圆，圆规两脚间距离（　）cm。",
      "prompt_region_ids": [
        "r_prompt_q16"
      ],
      "answer_region_ids": [
        "r_answer_q16"
      ],
      "question_type": "multiple_choice"
    },
    {
      "question_id": "q17",
      "page_id": "page_1",
      "index_on_page": 17,
      "prompt_text": "上衣先提价20%再降价20%，现价与原价相比（　）。",
      "prompt_region_ids": [
        "r_prompt_q17"
      ],
      "answer_region_ids": [
        "r_answer_q17"
      ],
      "question_type": "multiple_choice"
    },
    {
      "question_id": "q18",
      "page_id": "page_1",
      "index_on_page": 18,
      "prompt_text": "根据扇形统计图，参加乒乓球课程大约有（　）人。",
      "prompt_region_ids": [
        "r_prompt_q18"
      ],
      "answer_region_ids": [
        "r_answer_q18"
      ],
      "question_type": "multiple_choice"
    },
    {
      "question_id": "q19",
      "page_id": "page_2",
      "index_on_page": 1,
      "prompt_text": "直接写得数：15÷10/17=　，14×4/7=　，2/5×10%=　，4/5×1/4÷4/5×1/4=　，0.5+25%=　，3.14×9=　，2/3×0+3=　，300千克:1/4吨=　",
      "prompt_region_ids": [
        "r_prompt_q19"
      ],
      "answer_region_ids": [
        "r_answer_q19"
      ],
      "question_type": "calculation"
    },
    {
      "question_id": "q20",
      "page_id": "page_2",
      "index_on_page": 2,
      "prompt_text": "递等式计算：①1又1/5×2.75+1/4÷5/6  ②5/8×1/6−6×62.5%  ③60×(1−5/12+7/15)  ④3/4−7/16−0.125×8/7",
      "prompt_region_ids": [
        "r_prompt_q20"
      ],
      "answer_region_ids": [
        "r_answer_q20"
      ],
      "question_type": "calculation"
    },
    {
      "question_id": "q21",
      "page_id": "page_2",
      "index_on_page": 3,
      "prompt_text": "化简比：5/8：5/6；0.25：0.45；500千克：1.2吨；1.2平方米：80平方分米",
      "prompt_region_ids": [
        "r_prompt_q21"
      ],
      "answer_region_ids": [
        "r_answer_q21"
      ],
      "question_type": "calculation"
    },
    {
      "question_id": "q22",
      "page_id": "page_2",
      "index_on_page": 4,
      "prompt_text": "求下图中阴影部分的面积。",
      "prompt_region_ids": [
        "r_prompt_q22"
      ],
      "answer_region_ids": [
        "r_answer_q22"
      ],
      "question_type": "calculation"
    },
    {
      "question_id": "q23",
      "page_id": "page_3",
      "index_on_page": 1,
      "prompt_text": "根据台风移动路径（正西300km→西偏北40° 150km→北偏西20° 200km）画移动路线图。",
      "prompt_region_ids": [
        "r_prompt_q23"
      ],
      "answer_region_ids": [
        "r_answer_q23"
      ],
      "question_type": "unknown"
    },
    {
      "question_id": "q24",
      "page_id": "page_3",
      "index_on_page": 2,
      "prompt_text": "长6cm宽4cm的长方形内画最大圆，求面积（保留找圆心痕迹）。",
      "prompt_region_ids": [
        "r_prompt_q24"
      ],
      "answer_region_ids": [
        "r_answer_q24"
      ],
      "question_type": "calculation"
    },
    {
      "question_id": "q25",
      "page_id": "page_3",
      "index_on_page": 3,
      "prompt_text": "粉碎机每小时粉碎3/5吨，2/3小时可粉碎多少吨？25分钟可粉碎多少吨？",
      "prompt_region_ids": [
        "r_prompt_q25"
      ],
      "answer_region_ids": [
        "r_answer_q25"
      ],
      "question_type": "word_problem"
    },
    {
      "question_id": "q26",
      "page_id": "page_3",
      "index_on_page": 4,
      "prompt_text": "长城全长21200km，明朝6200km，秦朝是汉朝的1/2，求秦、汉长度。",
      "prompt_region_ids": [
        "r_prompt_q26"
      ],
      "answer_region_ids": [
        "r_answer_q26"
      ],
      "question_type": "word_problem"
    },
    {
      "question_id": "q27",
      "page_id": "page_3",
      "index_on_page": 5,
      "prompt_text": "四五六年级共80件获奖，比2:3:5，六年级比四年级多多少件？",
      "prompt_region_ids": [
        "r_prompt_q27"
      ],
      "answer_region_ids": [
        "r_answer_q27"
      ],
      "question_type": "word_problem"
    },
    {
      "question_id": "q28",
      "page_id": "page_4",
      "index_on_page": 1,
      "prompt_text": "田径场：①阴影活动场地面积 ②最内圈跑1圈米数 ③400米赛第二道起跑线前移距离",
      "prompt_region_ids": [
        "r_prompt_q28"
      ],
      "answer_region_ids": [
        "r_answer_q28"
      ],
      "question_type": "word_problem"
    },
    {
      "question_id": "q29",
      "page_id": "page_4",
      "index_on_page": 2,
      "prompt_text": "幸福村去年路灯65盏，今年104盏，今年比去年增加百分之几？",
      "prompt_region_ids": [
        "r_prompt_q29"
      ],
      "answer_region_ids": [
        "r_answer_q29"
      ],
      "question_type": "word_problem"
    },
    {
      "question_id": "q30",
      "page_id": "page_4",
      "index_on_page": 3,
      "prompt_text": "环保知识调查：补全统计表、求总人数、补全统计图。",
      "prompt_region_ids": [
        "r_prompt_q30"
      ],
      "answer_region_ids": [
        "r_answer_q30"
      ],
      "question_type": "word_problem"
    }
  ],
  "regions": [
    {
      "region_id": "r_prompt_q01",